{"$schema":"http://json-schema.org/draft-07/schema#","title":"问心量表文件 文件结构","type":"object","properties":{"name":{"description":"量表名称","type":"string"},"description":{"description":"量表描述","type":"string"},"answerTips":{"description":"作答提示","type":"string"},"resultTips":{"description":"结果解读说明","type":"string"},"references":{"description":"相关参考及引用","type":"array","items":{"type":"string"}},"options":{"description":"量表选项","type":"array","items":{"type":"object","properties":{"name":{"description":"选项内容","type":"string"},"score":{"description":"选项分值","type":"number"}},"required":["name","score"]}},"questions":{"description":"量表题目","type":"array","items":{"type":"object","properties":{"groupId":{"description":"题目组 Id","type":"number"},"content":{"description":"题目内容","type":"string"},"reverse":{"description":"开启反向评分（即把量表要求的选项分值在本题反转，但不反转选项内容）","type":"boolean"}},"required":["groupId","content"]}},"scoring":{"description":"评分标准及评分计算方法","type":"array","items":{"type":"object","properties":{"groupId":{"description":"评分组 Id（需与题目所分配的组 Id 对应)","type":"number"},"name":{"description":"当前评分组名称","type":"string"},"method":{"description":"分数计算方法，目前支持计算总和、平均值、总和的倍数（分为乘和除，具体倍率写在 “,” 后面）","type":"string","enum":["plus","average","multiply, ","division, "]},"ranges":{"description":"分值范围","type":"array","items":{"type":"object","properties":{"name":{"description":"当前分值范围名称","type":"string"},"min":{"description":"当前范围最小值（可以取等）","type":"number"},"max":{"description":"当前范围最大值（可以取等）","type":"number"},"color":{"description":"分值范围的颜色（用于分级）","type":"string","enum":["green","yellow","orange","red"]}},"required":["name","min","max"]}}},"required":["groupId","name","method","ranges"]}}},"required":["name","description","answerTips","references","options","questions","scoring"]}