{
    "name": "BSI-18（简明症状量表-18）",
    "description": "BSI-18（Brief Symptom Inventory-18）是由 Derogatis (2001) 基于 SCL-90 量表和 BSI-51 修订而成的简版问卷。它可以测量躯体化、抑郁和焦虑3个方面的症状。相比 SCL-90 作答时间缩短，可以便捷的筛查临床和社区人群。",
    "answerTips": "在随后的题目中有一些关于你身心状况的描述，请根据最近1周内下述情况影响你的实际感觉，选择相应的选项。",
    "resultTips": "下方每个因子的分数均在6-30分之间；每个因子的分数越高，表明该项症状越严重。",
    "references": [
        "常用心理评估量表手册（第3版）"
    ],
    "options": [
        {
            "name": "无",
            "score": 1
        },
        {
            "name": "轻度",
            "score": 2
        },
        {
            "name": "中度",
            "score": 3
        },
        {
            "name": "比较严重",
            "score": 4
        },
        {
            "name": "严重",
            "score": 5
        }
    ],
    "questions": [
        {
            "groupId": 1,
            "content": "头晕或晕倒"
        },
        {
            "groupId": 2,
            "content": "对事物不感兴趣"
        },
        {
            "groupId": 3,
            "content": "神经过敏，心中不踏实"
        },
        {
            "groupId": 1,
            "content": "胸痛"
        },
        {
            "groupId": 2,
            "content": "感到孤独"
        },
        {
            "groupId": 3,
            "content": "感到紧张或容易紧张"
        },
        {
            "groupId": 1,
            "content": "恶心或胃部不舒服"
        },
        {
            "groupId": 2,
            "content": "感到苦闷"
        },
        {
            "groupId": 3,
            "content": "无缘无故地突然感到害怕"
        },
        {
            "groupId": 1,
            "content": "呼吸有困难"
        },
        {
            "groupId": 2,
            "content": "感到自己没有什么价值"
        },
        {
            "groupId": 3,
            "content": "感到一阵阵恐惧或惊恐"
        },
        {
            "groupId": 1,
            "content": "身体发麻或感到刺痛"
        },
        {
            "groupId": 2,
            "content": "感到没有前途、没有希望"
        },
        {
            "groupId": 3,
            "content": "感到坐立不安、心神不宁"
        },
        {
            "groupId": 1,
            "content": "感到身体的某一部分软弱无力"
        },
        {
            "groupId": 2,
            "content": "想结束自己的生命"
        },
        {
            "groupId": 3,
            "content": "感到害怕"
        }
    ],
    "scoring": [
        {
            "groupId": 1,
            "name": "躯体化症状",
            "method": "plus",
            "ranges": [
                {
                    "name": "",
                    "min": 0,
                    "max": 30
                }
            ]
        },
        {
            "groupId": 2,
            "name": "抑郁",
            "method": "plus",
            "ranges": [
                {
                    "name": "",
                    "min": 0,
                    "max": 30
                }
            ]
        },
        {
            "groupId": 3,
            "name": "焦虑",
            "method": "plus",
            "ranges": [
                {
                    "name": "",
                    "min": 0,
                    "max": 30
                }
            ]
        }
    ]
}