{"$schema":"../questionnaire-schema.json","name":"HADS（医院焦虑抑郁量表）","description":"HADS（Hospital anxiety and depression scale，医院焦虑抑郁量表）是一个筛查量表。它的最佳用途是帮助综合医院医生筛查可疑存在焦虑或抑郁症状的患者，对阳性的患者做进一步的深入检查以明确诊断并给予相应的治疗。（注：由于问心的题目文件不能很好的支持设定每个题目的选项，故选项有改动）","answerTips":"情绪在大多数疾病中起着重要作用，如果医生了解您的情绪变化，他们就能给您更多的帮助。请您阅读以下各个条目，并选择其中最符合您上个月以来的情绪选项。对这些问题不要做过多的考虑，立即做出的回答会比考虑后再回答更切合实际。","references":["常用心理评估量表手册（第3版）"],"options":[{"name":"肯定或大多数时候","score":3},{"name":"多数时候","score":2},{"name":"有时","score":1},{"name":"很少或根本没有","score":0}],"questions":[{"groupId":1,"content":"我感到紧张（或痛苦）"},{"groupId":2,"content":"我对以往感兴趣的事情还是有兴趣","reverse":true},{"groupId":1,"content":"我感到有点害怕，好像预感到有什么可怕事情要发生"},{"groupId":2,"content":"我能够哈哈大笑，并看到事物好的一面","reverse":true},{"groupId":1,"content":"我的心中充满烦恼"},{"groupId":2,"content":"我感到愉快","reverse":true},{"groupId":1,"content":"我能够安静而轻松地坐着","reverse":true},{"groupId":2,"content":"我对自己的仪容（打扮自己）失去兴趣"},{"groupId":1,"content":"我有点坐立不安，好像感到非要活动不可"},{"groupId":2,"content":"我对一切都是乐观地向前看","reverse":true},{"groupId":1,"content":"我突然出现恐慌感"},{"groupId":2,"content":"我好像感到情绪在渐渐低落"},{"groupId":1,"content":"我感到有点害怕，好像某个内脏器官变坏了"},{"groupId":2,"content":"我能欣赏一本好书或一项好的广播或电视节目","reverse":true}],"scoring":[{"groupId":1,"name":"焦虑（A）","method":"plus","ranges":[{"name":"无症状","color":"green","min":0,"max":8},{"name":"有症状","color":"red","min":9,"max":21}]},{"groupId":2,"name":"抑郁（D）","method":"plus","ranges":[{"name":"无症状","color":"green","min":0,"max":8},{"name":"有症状","color":"red","min":9,"max":21}]}]}