{"$schema":"../questionnaire-schema.json","name":"PHQ-9 (Patient Health Questionnaire-9) 量表","description":"病人健康问卷（Patient Health Questionnaire-9，PHQ-9）是一个简便、有效的抑郁障碍自评量表，在抑郁症诊断的辅助和症状严重程度评估方面，均具有良好的信度和效度。","answerTips":"Over the last 2 weeks, how often have you been bothered by any of the following problems?","references":["https://www.apa.org/depression-guideline/patient-health-questionnaire.pdf","https://patient.info/doctor/patient-health-questionnaire-phq-9"],"options":[{"name":"Not at all","score":0},{"name":"Several days","score":1},{"name":"More than half the days","score":2},{"name":"Nearly every day","score":3}],"questions":[{"groupId":1,"content":"Little interest or pleasure in doing things"},{"groupId":1,"content":"Feeling down, depressed, or hopeless"},{"groupId":1,"content":"Trouble falling or staying asleep, or sleeping too much"},{"groupId":1,"content":"Feeling tired or having little energy"},{"groupId":1,"content":"Poor appetite or overeating"},{"groupId":1,"content":"Feeling bad about yourself — or that you are a failure or have let yourself or your family down"},{"groupId":1,"content":"Trouble concentrating on things, such as reading the newspaper or watching television"},{"id":8,"groupId":1,"content":"Moving or speaking so slowly that other people could have noticed? Or the opposite — being so fidgety or restless that you have been moving around a lot more than usual"},{"id":9,"groupId":1,"content":"Thoughts that you would be better off dead or of hurting yourself in some way"}],"scoring":[{"groupId":1,"name":"Depression","method":"plus","ranges":[{"name":"No depression","color":"green","min":0,"max":4},{"name":"Mild depression","color":"yellow","min":5,"max":9},{"name":"Moderate depression","color":"orange","min":10,"max":14},{"name":"Moderate severe depression","color":"orange","min":15,"max":19},{"name":"Severe depression","color":"red","min":20,"max":27}]}]}