{"$schema":"../questionnaire-schema.json","name":"GAD-7 (Generalized Anxiety Disorder-7) 量表","description":"GAD-7（Generalized Anxiety Disorder-7）心理状况筛查量表是一种常用于评估广泛性焦虑障碍的工具。该量表由七个问题组成，用于评估受访者在过去两周内的焦虑症状频率和严重程度。通过计分的方式，可以快速了解一个人是否存在焦虑症状及其严重程度。","answerTips":"Over the last 2 weeks, how often have you been bothered by the following problems?","references":["https://arc.psych.wisc.edu/self-report/generalized-anxiety-disorder-gad7/","https://patient.info/doctor/generalised-anxiety-disorder-assessment-gad-7"],"options":[{"name":"Not at all","score":0},{"name":"Several days","score":1},{"name":"More than half the days","score":2},{"name":"Nearly every day","score":3}],"questions":[{"groupId":1,"content":"Feeling nervous, anxious or on edge"},{"groupId":1,"content":"Not being able to or control worrying"},{"groupId":1,"content":"Worrying about too much of different things"},{"groupId":1,"content":"Trouble relaxing"},{"groupId":1,"content":"Being so restless that it is hard to sit still"},{"groupId":1,"content":"Being easily annoyed or irritable"},{"groupId":1,"content":"Feeling afraid as if something awful might happen"}],"scoring":[{"groupId":1,"name":"Anxiety","method":"plus","ranges":[{"name":"No anxiety","color":"green","min":0,"max":4},{"name":"Mild anxiety","color":"yellow","min":5,"max":9},{"name":"Moderate anxiety","color":"orange","min":10,"max":14},{"name":"Severe anxiety","color":"red","min":15,"max":21}]}]}